course_title,domain,sub_domain,level,duration,paid_free,price,url
"Global Disease Masterclass: Communicable Diseases Epidemiology, Intervention and Prevention",Health,Public Health,Beginner,1,Paid,2909.14,https://www.coursera.org/learn/global-disease-masterclass-communicable
Analysis of Algorithms,Computer Science,Algorithms,Advanced,1,Free,0,https://www.coursera.org/learn/analysis-of-algorithms
Key Industry 4.0 Technologies in Manufacturing - 2,Business,Business Essentials,Intermediate,1,Free,0,https://www.coursera.org/learn/key-industry-4-point-0-technologies-in-manufacturing--2
"Economics of Markets, Government, and Nonprofits",Business,Finance,Beginner,1,Paid,3395.11,https://www.coursera.org/learn/economics-of-markets-government-and-nonprofits
Overcoming Bias,Business,Business Essentials,Beginner,1,Paid,3876.9,https://www.coursera.org/learn/overcoming-bias
Introduction to Networking and Cloud Computing,Information Technology,Security,Beginner,1,Paid,3609.7,https://www.coursera.org/learn/introduction-to-networking-and-cloud-computing
Fundamentals of Materials Science,Physical Science and Engineering,Physics and Astronomy,Intermediate,4,Paid,5737.28,https://www.coursera.org/learn/fundamentals-of-materials-science
"Surveillance Systems: Analysis, Dissemination, and Special Systems",Health,Public Health,Beginner,1,Paid,3882.75,https://www.coursera.org/learn/epidemiology-surveillance-systems-analysis
IS/IT Governance,Information Technology,Support and Operations,Beginner,1,Paid,3140.44,https://www.coursera.org/learn/is-it-governance
"Authentication, E-Commerce Features & Order Management",Computer Science,Software Development,Intermediate,1,Paid,3680.68,https://www.coursera.org/learn/packt-authentication-e-commerce-features-order-management-hjj1v
"Sleep: Neurobiology, Medicine, and Society",Health,Basic Science,Beginner,1,Paid,2875.74,https://www.coursera.org/learn/sleep
Advanced Modeling Techniques and Detailed Prop Creation,Computer Science,Design and Product,Intermediate,1,Paid,4741.96,https://www.coursera.org/learn/packt-advanced-modeling-techniques-and-detailed-prop-creation-mkp0q
Finding Mutations in DNA and Proteins (Bioinformatics VI),Health,Health Informatics,Intermediate,1,Free,0,https://www.coursera.org/learn/dna-mutations
"Personal Finance, Wealth Management, And Investing With AI",Business,Finance,Beginner,1,Free,0,https://www.coursera.org/learn/personal-finance-with-ai
Fake News Detection with Machine Learning,Data Science,Machine Learning,Beginner,1,Free,0,https://www.coursera.org/learn/nlp-fake-news-detector
"Financial Statements, Ratios, and Month-End Close Essentials",Business,Business Essentials,Beginner,1,Paid,3189.7,https://www.coursera.org/learn/financial-statements-ratios-and-month-end-close-essentials
Apply UI/UX Design with Figma for Modern Interfaces,Computer Science,Software Development,Beginner,1,Paid,3120.4,https://www.coursera.org/learn/apply-ui-ux-design-with-figma-for-modern-interfaces
Excel: Modeling with Power Pivot and Reporting Insights,Business,Business Essentials,Beginner,1,Paid,3216.42,https://www.coursera.org/learn/excel-modeling-power-pivot-reporting-insights-lo091157
Microsoft Security Solutions Capabilities,Information Technology,Cloud Computing,Intermediate,1,Paid,3872.73,https://www.coursera.org/learn/microsoft-security-solutions-capabilities
Ensure Supplier Quality: Inspect and Verify,Business,Business Essentials,Beginner,1,Paid,3562.11,https://www.coursera.org/learn/ensure-supplier-quality-inspect--verify
Fraud Detection on Financial Transactions with Machine Learning on Google Cloud,Information Technology,Cloud Computing,Intermediate,1,Paid,4356.2,https://www.coursera.org/learn/googlecloud-fraud-detection-on-financial-transactions-with-machine-learnin-3bian
Build REST APIs with Go and MongoDB,Computer Science,Mobile and Web Development,Beginner,1,Free,0,https://www.coursera.org/learn/build-rest-apis-with-go-and-mongodb
Advanced Data Analysis and Visualization with Pandas,Data Science,Data Analysis,Advanced,1,Paid,7160.12,https://www.coursera.org/learn/packt-advanced-data-analysis-and-visualization-with-pandas-ofifg
Process Forms with AI Model in Power Automate,Information Technology,Cloud Computing,Beginner,1,Paid,3762.51,https://www.coursera.org/learn/process-forms-ai-model-power-automate
Methods for Quantitative Research in Psychology,Health,Psychology,Beginner,1,Paid,3056.1,https://www.coursera.org/learn/methods-for-quantitative-research-in-psychology
Prescriptive Analytics Project Ideation,Business,Leadership and Management,Beginner,1,Paid,3142.94,https://www.coursera.org/learn/prescriptive-analytics-project-ideation
Practical Windows PowerShell Scripting: Unit 1,Information Technology,Support and Operations,Beginner,1,Free,0,https://www.coursera.org/learn/pearson-practical-windows-powershell-scripting-unit1
Strategic SEO: A Quick Start to Reach a Wider Audience,Business,Marketing,Beginner,1,Paid,2960.08,https://www.coursera.org/learn/strategic-seo-a-quick-start-to-reach-a-wider-audience
Learn Bootstrap,Computer Science,Software Development,Intermediate,1,Paid,3984.62,https://www.coursera.org/learn/learn-bootstrap
Deploying a Multi-Cluster Gateway Across GKE Clusters,Information Technology,Cloud Computing,Advanced,1,Paid,7689.52,https://www.coursera.org/learn/googlecloud-deploying-a-multi-cluster-gateway-across-gke-clusters-sul8j
Internet of Things: Governance and Real-World Implementation,Information Technology,Networking,Beginner,1,Paid,3303.26,https://www.coursera.org/learn/internet-of-things-iot-governance-real-world-implementation-cnx0002
"Enterprise Sales Mastery-Hunting, Deal Strategy & Leadership",Business,Leadership and Management,Advanced,1,Paid,7454.88,https://www.coursera.org/learn/enterprise-sales-hunting-deal-strategy-leadership
Code Yourself! An Introduction to Programming,Computer Science,Software Development,Beginner,1,Paid,3112.04,https://www.coursera.org/learn/intro-programming
"Nanotechnology and Nanosensors, Part 2",Physical Science and Engineering,Chemistry,Beginner,1,Paid,3052.76,https://www.coursera.org/learn/nanotechnology2
React Beginner Project: Build a Color Picker Tool,Computer Science,Mobile and Web Development,Intermediate,1,Paid,3768.36,https://www.coursera.org/learn/javascript-project-build-a-color-picker-tool
Fundamentals of Credit Analysis,Business,Finance,Beginner,1,Paid,3576.3,https://www.coursera.org/learn/fundamentals-of-credit-analysis
Connected Leadership: Building Collaborative Teams,Business,Leadership and Management,Beginner,1,Free,0,https://www.coursera.org/learn/connected-leadership-building-collaborative-teams
Politics and Ethics of Data Analytics in the Public Sector,Social Sciences,Governance and Society,Intermediate,1,Paid,4701.88,https://www.coursera.org/learn/politics-and-ethics-of-data-analytics-in-the-public-sector
The DMAIC Framework - Define and Measure Phase,Data Science,Data Analysis,Beginner,1,Paid,3068.62,https://www.coursera.org/learn/the-dmaic-framework---define-and-measure-phase
Anatomy & Physiology: Support & Movement,Health,Basic Science,Intermediate,1,Paid,3540.4,https://www.coursera.org/learn/anatomy--physiology-support--movement
.NET Core Microservices - The Complete Guide (.NET 6 MVC),Computer Science,Software Development,Beginner,1,Free,0,https://www.coursera.org/learn/packt-net-core-microservices-the-complete-guide-net-6-mvc-djsov
"Advanced AWS Deployment, Databases & Optimization",Computer Science,Software Development,Advanced,1,Paid,6077.96,https://www.coursera.org/learn/packt-advanced-aws-deployment-databases-optimization-zfruz
Fundamentals of Information System Security Architecture,Information Technology,Security,Beginner,1,Paid,3897.78,https://www.coursera.org/learn/information-system-security-architecture-first-course-1
Building RAG and MCP Servers with Claude,Computer Science,Computer Security and Networks,Intermediate,1,Paid,4537.39,https://www.coursera.org/learn/building-rag-and-mcp-servers-with-claude
Transfer Learning for NLP with TensorFlow Hub,Data Science,Machine Learning,Intermediate,1,Paid,4444.7,https://www.coursera.org/learn/transfer-learning-nlp-tensorflow-hub
Being a researcher (in Information Science and Technology),Physical Science and Engineering,Research Methods,Beginner,1,Paid,3031.88,https://www.coursera.org/learn/being-researcher
5 Ways to Build a Better LinkedIn Profile,Business,Leadership and Management,Intermediate,1,Paid,3968.76,https://www.coursera.org/learn/5-ways-build-better-linkedin-profile
AI Systems Design: RAG Pipelines and LLM Architecture,Computer Science,Software Development,Intermediate,1,Paid,4098.18,https://www.coursera.org/learn/ai-systems-design-rag-pipelines-and-llm-architecture
Introduction to Back-End Development,Computer Science,Mobile and Web Development,Beginner,1,Paid,3634.76,https://www.coursera.org/learn/introduction-to-back-end-development
Java Basics: Selection and Iteration,Computer Science,Software Development,Beginner,1,Paid,3850.18,https://www.coursera.org/learn/codio-java-basics
The Complete Java Developer Course: From Beginner to Master,Computer Science,Software Development,Beginner,1,Paid,3725.77,https://www.coursera.org/learn/packt-the-complete-java-developer-course-from-beginner-to-master-prvaq
Analyze and Visualize Data Using Power BI,Data Science,Data Analysis,Beginner,1,Free,0,https://www.coursera.org/learn/analyze-and-visualize-data-using-power-bi
"Monitoring, Security, and High Availability in Vault",Information Technology,Security,Intermediate,1,Paid,3734.12,https://www.coursera.org/learn/packt-monitoring-security-and-high-availability-in-vault-j9y41
Advanced Competitive Strategy,Business,Business Strategy,Beginner,1,Paid,3015.18,https://www.coursera.org/learn/advanced-competitive-strategy
U101: Understanding College and College Life,Social Sciences,Education,Beginner,1,Paid,3882.75,https://www.coursera.org/learn/college-life
Building High-Performing Teams,Business,Leadership and Management,Beginner,1,Free,0,https://www.coursera.org/learn/high-performing-teams
Generative AI for AWS Cloud Engineers,Computer Science,Software Development,Intermediate,1,Paid,3765.02,https://www.coursera.org/learn/generative-ai-for-aws-cloud-engineers
Validate and Track Data History Confidently,Data Science,Data Analysis,Advanced,1,Free,0,https://www.coursera.org/learn/validate-and-track-data-history-confidently
Build and Implement Web Applications Using Golang,Computer Science,Mobile and Web Development,Beginner,1,Paid,3499.48,https://www.coursera.org/learn/build-and-implement-web-applications-using-golang
Social Determinants of Health: Planetary Health,Health,Health Informatics,Beginner,1,Paid,2967.59,https://www.coursera.org/learn/sdoh-planetary-health
Professional Skills: Emotional Intelligence,Business,Business Essentials,Beginner,1,Free,0,https://www.coursera.org/learn/ps-emotional-intelligence
Nutrition Hot Topics and Controversies,Health,Nutrition,Beginner,1,Free,0,https://www.coursera.org/learn/nutrition-hot-topics-and-controversies
Java SE 17 Developer (1Z0-829): Unit 1,Information Technology,Support and Operations,Intermediate,1,Paid,3546.24,https://www.coursera.org/learn/pearson-java-se-17-developer-1z0-829-video-course-1-wl3tv
Researcher's guide to RNA sequencing data,Data Science,Data Analysis,Intermediate,1,Free,0,https://www.coursera.org/learn/researchers-guide-to-rna-sequencing-data
Automation with Ansible: Web Server Deployment,Computer Science,Software Development,Intermediate,1,Paid,3999.65,https://www.coursera.org/learn/automation-with-ansible--web-server-deployment
European Business Law: Doing Business in Europe,Business,Business Essentials,Beginner,2,Free,0,https://www.coursera.org/learn/eu-law-doing-business
Python for Data Visualization - A Beginner's Guide,Data Science,Data Analysis,Beginner,1,Free,0,https://www.coursera.org/learn/packt-python-for-data-visualization-a-beginners-guide-n1mmn
Learn Angular Routing by building a Cocktails Application,Computer Science,Mobile and Web Development,Advanced,1,Paid,5672.16,https://www.coursera.org/learn/angular-routing
Community-Based Climate Change Solutions,Physical Science and Engineering,Environmental Science and Sustainability,Beginner,1,Paid,3229.78,https://www.coursera.org/learn/climate-change-community-solutions
GenAI for Paralegals: Streamlining Legal Drafting,Data Science,Machine Learning,Beginner,1,Paid,3584.66,https://www.coursera.org/learn/genai-for-paralegals-streamlining-legal-drafting
Examining MPLS VPN Operation,Information Technology,Networking,Beginner,1,Paid,3296.58,https://www.coursera.org/learn/examining-mpls-vpn-operation
Security Operations,Computer Science,Computer Security and Networks,Intermediate,1,Paid,3943.7,https://www.coursera.org/learn/packt-security-operations-mrcgl
Foundations of Neuroscience,Social Sciences,Governance and Society,Intermediate,1,Paid,4062.28,https://www.coursera.org/learn/foundations-of-neuroscience
Deploying the circular economy within organisations,Business,Leadership and Management,Beginner,1,Free,0,https://www.coursera.org/learn/deploying-circular-economy-within-organisations
Power and Foreign Policy in International Relations,Social Sciences,Governance and Society,Beginner,1,Free,0,https://www.coursera.org/learn/power-and-foreign-policy-in-international-relations
AZ-204 Developing Solutions for Microsoft Azure,Information Technology,Cloud Computing,Intermediate,1,Paid,3528.71,https://www.coursera.org/learn/packt-az-204-developing-solutions-for-microsoft-azure-qjfyc
The Beauty of Kunqu Opera,Arts and Humanities,Music and Art,Beginner,1,Paid,2859.04,https://www.coursera.org/learn/kunqu-opera
Testing and Deploying Angular Applications,Computer Science,Mobile and Web Development,Intermediate,1,Paid,3601.36,https://www.coursera.org/learn/testing-and-deploying-angular-applications
Interacting with Vault Policies,Information Technology,Cloud Computing,Beginner,1,Paid,3424.34,https://www.coursera.org/learn/googlecloud-interacting-with-vault-policies-epn68
XML Practical - XSLT and SVG Project,Computer Science,Software Development,Beginner,1,Paid,2800.59,https://www.coursera.org/learn/xml-practical-xslt-and-svg-project
"The Sustainable Development Goals – A global, transdisciplinary vision for the future",Social Sciences,Governance and Society,Beginner,1,Free,0,https://www.coursera.org/learn/global-sustainable-development
Mastering Special Purpose Entities: Analyze and Apply SPE,Business,Business Essentials,Beginner,1,Paid,3014.35,https://www.coursera.org/learn/mastering-special-purpose-entities-analyze-apply-spe
Programming with Java,Computer Science,Software Development,Beginner,1,Free,0,https://www.coursera.org/learn/programming-with-java
Spacecraft Relative Motion Kinematics and Kinetics,Physical Science and Engineering,Physics and Astronomy,Advanced,2,Free,0,https://www.coursera.org/learn/spacecraft-relative-motion-kinematics-and-kinetics
Tracking and Reporting,Business,Business Essentials,Beginner,1,Free,0,https://www.coursera.org/learn/airs-tracking-and-reporting
Apply PowerShell Scripting for Automation and Projects,Information Technology,Support and Operations,Beginner,1,Free,0,https://www.coursera.org/learn/apply-powershell-scripting-for-automation-and-projects
Practical Project Management for Managers,Business,Leadership and Management,Intermediate,1,Free,0,https://www.coursera.org/learn/practical-project-management-for-managers
Strategic Brand Management: Storytelling & Positioning,Business,Marketing,Beginner,1,Paid,2944.21,https://www.coursera.org/learn/strategic-brand-building-identity-storytelling-positioning
"Transform, Analyze, and Report Data with R",Data Science,Data Analysis,Beginner,1,Paid,2961.74,https://www.coursera.org/learn/transform-analyze-and-report-data-with-r
Introduction to AKS and Core Networking Concepts,Information Technology,Networking,Intermediate,1,Paid,3846.01,https://www.coursera.org/learn/packt-introduction-to-aks-and-core-networking-concepts-i9q4p
AWS Elastic Beanstalk & CI/CD for Cloud Projects,Data Science,Data Analysis,Beginner,1,Paid,3199.72,https://www.coursera.org/learn/aws-elastic-beanstalk-cicd-cloud-projects
Python for Data Analysis: Step-By-Step with Projects,Data Science,Data Analysis,Beginner,1,Paid,3439.36,https://www.coursera.org/learn/packt-python-for-data-analysis-step-by-step-with-projects-kz1ja
AI for Teachers with ChatGPT,Computer Science,Software Development,Beginner,1,Paid,3529.54,https://www.coursera.org/learn/packt-ai-for-teachers-with-chatgpt-8omll
Strategies for Scaling and Optimizing Content,Business,Marketing,Intermediate,1,Paid,4071.46,https://www.coursera.org/learn/strategies-for-scaling-and-optimizing-content
Oracle RAC Advanced Operations and Deployment Scenarios,Information Technology,Support and Operations,Advanced,1,Paid,6331.8,https://www.coursera.org/learn/packt-oracle-rac-advanced-operations-and-deployment-scenarios-xqe9z
React Native: Developing Android and iOS Apps,Computer Science,Mobile and Web Development,Intermediate,2,Paid,4831.31,https://www.coursera.org/learn/react-native-developing-android-and-ios-apps
"Agroforestry IV: Climate, Carbon Storage and Agroforestry",Physical Science and Engineering,Environmental Science and Sustainability,Intermediate,1,Paid,4236.79,https://www.coursera.org/learn/agroforestry4
Public Health in Humanitarian Crises 1,Social Sciences,Governance and Society,Beginner,1,Paid,3412.64,https://www.coursera.org/learn/humanitarian-public-health
Monetize Your 3D Art: Sell Assets & Grow Your Audience,Business,Marketing,Beginner,1,Paid,2919.16,https://www.coursera.org/learn/monetize-your-3d-art-sell-assets--grow-your-audience
Change Leadership: Developing Strategic Gap Analysis in Miro,Business,Business Strategy,Intermediate,1,Free,0,https://www.coursera.org/learn/change-gap-analysis
Introduction to Learning Transfer and Life Long Learning (3L),Business,Business Essentials,Beginner,1,Free,0,https://www.coursera.org/learn/intro-learning-transfer
Salesforce Agents: Building AI-Powered Automations,Business,Leadership and Management,Intermediate,1,Free,0,https://www.coursera.org/learn/salesforce-agents-building-ai-powered-automations
Fundamentals of Red Hat Enterprise Linux,Information Technology,Support and Operations,Beginner,2,Paid,3818.46,https://www.coursera.org/learn/fundamentals-of-red-hat-enterprise-linux-9
Key Concepts in Organizational DE&I,Business,Leadership and Management,Intermediate,1,Paid,4077.3,https://www.coursera.org/learn/key-concepts-in-organizational-dei
"The Emergence of Oncofertility (Past, Present & Future)",Health,Patient Care,Beginner,1,Free,0,https://www.coursera.org/learn/oncofertility-overview
Managing Customer Expectations with Jagdish Sheth,Business,Entrepreneurship,Beginner,1,Paid,2935.02,https://www.coursera.org/learn/customer-centricity-with-jagdish-sheth-course-4
Global Disease Masterclass: Global Disease Distribution,Health,Public Health,Beginner,1,Free,0,https://www.coursera.org/learn/global-disease-distribution
Working with Onscreen Data in a Flutter Application,Computer Science,Mobile and Web Development,Beginner,1,Free,0,https://www.coursera.org/learn/googlecloud-working-with-onscreen-data-in-a-flutter-application-jtyou
Build Performance Dashboards,Business,Business Strategy,Beginner,1,Paid,3052.76,https://www.coursera.org/learn/build-performance-dashboards
Create a Business Marketing Brand Kit Using Canva,Business,Marketing,Intermediate,1,Paid,4644.27,https://www.coursera.org/learn/create-business-marketing-brand-kit-using-canva
Python for the Absolute Beginner,Computer Science,Software Development,Beginner,1,Paid,3450.22,https://www.coursera.org/learn/python-for-the-absolute-beginner
Word Forms and Simple Present Tense,Language Learning,Learning English,Beginner,1,Free,0,https://www.coursera.org/learn/word-forms-simple-present-tense
AI for Product Owners,Business,Leadership and Management,Beginner,1,Paid,3724.1,https://www.coursera.org/learn/ai-for-product-owners
HDFS Architecture and Programming,Information Technology,Data Management,Intermediate,1,Paid,4520.69,https://www.coursera.org/learn/hdfs-architecture-and-programming
Leadership Essentials,Business,Leadership and Management,Beginner,2,Paid,4038.9,https://www.coursera.org/learn/leadership-essentials
Secure VPC Networks with Cloud Next Generation Firewall,Information Technology,Cloud Computing,Intermediate,1,Paid,4182.52,https://www.coursera.org/learn/secure-vpc-networks-with-cloud-next-generation-firewall
Operations Research (3): Theory,Computer Science,Algorithms,Advanced,1,Paid,7628.56,https://www.coursera.org/learn/operations-research-theory
Medical Terminology II,Health,Basic Science,Beginner,1,Paid,3787.56,https://www.coursera.org/learn/medicalterminology-2
Ingesting HL7v2 Data with the Healthcare API,Information Technology,Cloud Computing,Beginner,1,Free,0,https://www.coursera.org/learn/googlecloud-ingesting-hl7v2-data-with-the-healthcare-api-xdnyz
Alteryx Advanced,Data Science,Data Analysis,Intermediate,1,Free,0,https://www.coursera.org/learn/packt-alteryx-advanced-8ynsl
Writing Clean Code: 20 Code Smells & How to Avoid Them,Computer Science,Software Development,Intermediate,1,Paid,4109.04,https://www.coursera.org/learn/packt-writing-clean-code-20-code-smells-how-to-avoid-them-g2oer
Implement Jenkins CI/CD Pipelines for Real-World Deployment,Information Technology,Support and Operations,Beginner,1,Paid,3437.7,https://www.coursera.org/learn/implement-jenkins-ci-cd-pipelines-for-real-world-deployment
Preparing for Graduate Study in the U.S.: A course for international students,Language Learning,Learning English,Beginner,1,Paid,2970.93,https://www.coursera.org/learn/graduate-study-usa
"Human Capital: Teams, Unions, and Change Management",Business,Business Strategy,Intermediate,1,Paid,4580.81,https://www.coursera.org/learn/human-capital-teams-unions-and-change-management
Public Health Principles:  Systems and Strategies,Health,Healthcare Management,Intermediate,1,Paid,4568.28,https://www.coursera.org/learn/public-health-principles-systems-and-strategies
Automate and Verify Marketing Reports Accurately,Business,Marketing,Beginner,1,Paid,3674,https://www.coursera.org/learn/automate-and-verify-marketing-reports-accurately
Hardware Security,Computer Science,Computer Security and Networks,Beginner,1,Paid,3374.23,https://www.coursera.org/learn/hardware-security
Cloud Computing Law: Transactions,Social Sciences,Law,Beginner,1,Paid,3319.12,https://www.coursera.org/learn/cloud-computing-law-transactions
Deep Neural Network for Beginners Using Python,Data Science,Machine Learning,Beginner,1,Paid,3901.12,https://www.coursera.org/learn/packt-deep-neural-network-for-beginners-using-python-u1run
Data Science Project Capstone: Predicting Bicycle Rental,Data Science,Data Analysis,Beginner,1,Free,0,https://www.coursera.org/learn/data-science-project-capstone-predicting-bicycle-rental
Engineering of Structures: Shear and Bending,Physical Science and Engineering,Mechanical Engineering,Beginner,1,Paid,2850.69,https://www.coursera.org/learn/engineering-of-structures-shear-and-bending
Kubernetes & Cloud Native Associate (KCNA) Prep,Computer Science,Computer Security and Networks,Intermediate,1,Paid,3828.48,https://www.coursera.org/learn/packt-kubernetes-cloud-native-associate-kcna-prep-h12ek
Intro to Null Hypothesis Significance Testing with z-test,Data Science,Data Analysis,Beginner,1,Paid,2965.92,https://www.coursera.org/learn/nhst-and-z-test
The Nuts and Bolts of Public Relations,Business,Marketing,Beginner,1,Free,0,https://www.coursera.org/learn/the-nuts-and-bolts-of-public-relations
React Native,Computer Science,Mobile and Web Development,Intermediate,1,Paid,3740.8,https://www.coursera.org/learn/react-native-course
Master Excel Advanced Functions and Analytics,Business,Finance,Beginner,1,Paid,3755.83,https://www.coursera.org/learn/master-excel-advanced-functions-analytics
GUI Development and AI-Enhanced Programming,Computer Science,Software Development,Beginner,1,Paid,2973.44,https://www.coursera.org/learn/gui-development-and-ai-enhanced-programming
Performance Optimization and Scalability,Computer Science,Software Development,Beginner,1,Free,0,https://www.coursera.org/learn/performance-optimization-and-scalability
Instructional Design Foundations and Applications,Social Sciences,Education,Beginner,1,Paid,3314.95,https://www.coursera.org/learn/instructional-design-foundations-applications
Using Cloud Trace on Kubernetes Engine,Information Technology,Cloud Computing,Intermediate,1,Paid,3898.62,https://www.coursera.org/learn/googlecloud-using-cloud-trace-on-kubernetes-engine-1h3mh
Conduct UX Research and Test Early Concepts,Computer Science,Design and Product,Beginner,1,Paid,2992.64,https://www.coursera.org/learn/conduct-ux-research
Data Connection and Functionalities in Power BI,Information Technology,Data Management,Intermediate,1,Paid,4479.77,https://www.coursera.org/learn/data-connection-and-functionalities-in-power-bi
"Dinosaurs: Evolution, Extinction, and Paleobiology",Physical Science and Engineering,Research Methods,Beginner,1,Paid,3871.9,https://www.coursera.org/learn/dinosaurs
Programming with JavaScript,Computer Science,Mobile and Web Development,Beginner,1,Paid,3638.93,https://www.coursera.org/learn/programming-with-javascript
Unit Testing in React.js: Create a Unit Test Suite,Computer Science,Software Development,Intermediate,1,Paid,4858.86,https://www.coursera.org/learn/rudi-hinds-unit-testing-in-react-create-a-unit-test-suite-react-testing-liibrary
"Visualize the 10,000 Bitcoin Pizza Transaction Using BigQuery and AI Notebooks",Information Technology,Cloud Computing,Beginner,1,Free,0,https://www.coursera.org/learn/googlecloud-visualize-the-10-000-bitcoin-pizza-transaction-using-bigquery-c2igp
